{
  "$schema": "https://json-schema.org/draft/2020-12/schema",
  "title": "Sisyphus Spec",
  "description": "A spec-driven artifact definition with boulders, stack sources, and acceptance criteria",
  "type": "object",
  "required": ["title", "layer", "output", "boulders"],
  "properties": {
    "title": { "type": "string", "description": "Human-readable title for this spec" },
    "description": { "type": "string", "description": "Brief description of what this spec produces" },
    "layer": { "type": "string", "description": "Domain layer to use (e.g., 'documentation')" },
    "output": { "type": "string", "description": "Output file path (relative to working directory)" },
    "maxRetries": { "type": "integer", "default": 3, "minimum": 1, "maximum": 10, "description": "Default max retries per boulder" },
    "boulders": {
      "type": "array",
      "minItems": 1,
      "items": { "$ref": "#/$defs/boulder" }
    }
  },
  "$defs": {
    "boulder": {
      "type": "object",
      "required": ["name", "description", "criteria"],
      "properties": {
        "name": { "type": "string", "description": "Boulder name" },
        "description": { "type": "string", "description": "What this boulder should produce" },
        "stack": { "type": "array", "items": { "$ref": "#/$defs/stackSource" }, "description": "Data sources to stack before producing" },
        "criteria": { "type": "array", "minItems": 1, "items": { "$ref": "#/$defs/criterion" }, "description": "Acceptance criteria for this boulder" },
        "maxRetries": { "type": "integer", "minimum": 0, "description": "Override max retries for this boulder" }
      }
    },
    "stackSource": {
      "type": "object",
      "required": ["type"],
      "properties": {
        "type": { "type": "string", "description": "Stack backend type (e.g., 'analysis')" },
        "source": { "type": "string", "description": "File path or glob pattern" },
        "instruction": { "type": "string", "description": "What to extract from the source" }
      },
      "additionalProperties": true
    },
    "criterion": {
      "type": "object",
      "required": ["check", "description"],
      "properties": {
        "check": { "type": "string", "description": "Check type (structural checks registered by layer, or 'custom' for LLM evaluation)" },
        "description": { "type": "string", "description": "Human-readable description of what this criterion verifies" }
      },
      "additionalProperties": true
    }
  }
}
