{
  "title": "ALM Entity Migration Status Report",
  "description": "Comprehensive status of all alm_ entity migrations from legacy SQL through staging to Dataverse",
  "layer": "documentation",
  "output": "output/reports/alm-migration-status.md",
  "maxRetries": 3,
  "boulders": [
    {
      "name": "Entity Inventory",
      "description": "Complete list of all alm_ prefixed entities with their current migration status and notes on blockers or dependencies",
      "stack": [
        {
          "type": "analysis",
          "source": "dataverse-schema/_index.json",
          "instruction": "Extract all entities with logicalName starting with 'alm_'. Return array of {logicalName, entitySetName, primaryId, attributeCount: number of attributes}"
        },
        {
          "type": "analysis",
          "source": "work-repo/pipeline/*.json",
          "instruction": "List all pipeline names that reference alm_ entities in their SQL queries or parameters"
        }
      ],
      "criteria": [
        {
          "check": "contains-table",
          "columns": ["Entity", "Status", "Pipeline", "Notes"],
          "description": "Table with entity name, migration status, associated pipeline, and notes"
        },
        {
          "check": "row-count-gte",
          "source": "stack[0]",
          "min": 1,
          "description": "At least one row per entity found in schema index"
        },
        {
          "check": "custom",
          "description": "Each entity has a status value from: Complete, In Progress, Not Started, Blocked, N/A"
        },
        {
          "check": "custom",
          "description": "Entities with status 'Blocked' must have a note explaining the blocker"
        }
      ]
    },
    {
      "name": "Pipeline Coverage",
      "description": "Summary of which pipelines handle which entities, run frequency, and recent success/failure rates",
      "stack": [
        {
          "type": "analysis",
          "source": "work-repo/pipeline/*.json",
          "instruction": "For each pipeline, extract: name, entities referenced in SQL, any ForEach loops or parameterized entity lists"
        }
      ],
      "criteria": [
        {
          "check": "contains-table",
          "columns": ["Pipeline", "Entities", "Notes"],
          "description": "Table mapping pipelines to entities with coverage notes"
        },
        {
          "check": "custom",
          "description": "Every entity from the Entity Inventory boulder is covered by at least one pipeline, or explicitly marked as 'No pipeline' with explanation"
        }
      ]
    },
    {
      "name": "Open Issues",
      "description": "Active errors and blockers related to the migration",
      "stack": [
        {
          "type": "analysis",
          "source": "errors/",
          "instruction": "List recent error files with timestamps and brief descriptions of the failures"
        }
      ],
      "criteria": [
        {
          "check": "contains-table",
          "columns": ["Error", "Entity", "Severity", "Notes"],
          "description": "Table of active errors with entity association"
        },
        {
          "check": "custom",
          "description": "Each error is linked to a specific entity from the Entity Inventory, or marked as 'cross-cutting' with explanation"
        }
      ]
    }
  ]
}
